{
  "$schema": "https://json-schema.org/draft/2020-12/schema",
  "$id": "urn:rtx-monitor:schema:nvapi-voltage-status-v1-observation:2",
  "title": "RTX Monitor NVAPI voltage status v1 observation v2",
  "type": "object",
  "additionalProperties": false,
  "required": [
    "schema_version",
    "source_kind",
    "capture_session_id",
    "capture_started_utc",
    "captured_utc",
    "duration_seconds",
    "process_id",
    "profile",
    "references",
    "call_count",
    "samples",
    "warning"
  ],
  "properties": {
    "schema_version": { "const": 2 },
    "source_kind": { "const": "nvapi_voltage_status_v1_observation" },
    "capture_session_id": { "type": "string", "format": "uuid" },
    "capture_started_utc": { "type": "string", "format": "date-time" },
    "captured_utc": { "type": "string", "format": "date-time" },
    "duration_seconds": { "type": "integer", "minimum": 10, "maximum": 60 },
    "process_id": { "type": "integer", "minimum": 1 },
    "profile": {
      "type": "object",
      "additionalProperties": false,
      "required": [
        "profile_name",
        "gpu",
        "identity_probe_sha256",
        "gpuz_sha256",
        "debugger_sha256",
        "debugger_file_version",
        "candidate_inventory_sha256",
        "prior_observation_sha256",
        "nvapi_module_sha256",
        "loaded_nvapi_module",
        "interface_id",
        "function_rva",
        "caller_module_name",
        "caller_rva",
        "buffer_ebp_displacement_bytes",
        "structure_version",
        "structure_size_bytes",
        "value_word_index",
        "value_offset_bytes",
        "scale_divisor"
      ],
      "properties": {
        "profile_name": { "const": "gpuz-2.70.0-nvapi-610.88-voltage-status-v1" },
        "gpu": {
          "type": "object",
          "additionalProperties": false,
          "required": [
            "name",
            "uuid",
            "driver_version",
            "nvml_version",
            "pci_bus_id",
            "pci_vendor_id",
            "pci_device_id",
            "pci_subsystem_vendor_id",
            "pci_subsystem_device_id",
            "vbios_version"
          ],
          "properties": {
            "name": { "const": "NVIDIA GeForce RTX 3060" },
            "uuid": { "const": "GPU-11111111-2222-3333-4444-555555555555" },
            "driver_version": { "const": "610.88" },
            "nvml_version": { "const": "13.610.88" },
            "pci_bus_id": { "const": "00000000:01:00.0" },
            "pci_vendor_id": { "const": "0x10de" },
            "pci_device_id": { "const": "0x2504" },
            "pci_subsystem_vendor_id": { "const": "0x10de" },
            "pci_subsystem_device_id": { "const": "0x1536" },
            "vbios_version": { "const": "94.06.25.00.fc" }
          }
        },
        "identity_probe_sha256": { "$ref": "#/$defs/sha256" },
        "gpuz_sha256": { "const": "6cb0ef29682452de81a9576808881685161411a1fad00938ba04131159979c29" },
        "debugger_sha256": { "$ref": "#/$defs/sha256" },
        "debugger_file_version": { "type": "string", "minLength": 1, "maxLength": 128 },
        "candidate_inventory_sha256": { "const": "3aaada9b367dacca7cf74511bae8532bd79b7f8bd06b9bb609056f3d9da1f1d7" },
        "prior_observation_sha256": { "const": "c7a63df5e6a30bccbba5ad8c1a62a9251c40d512cd74060e69e043cfc54f77b3" },
        "nvapi_module_sha256": { "const": "fbc9aed43bfa5bda19b7f83a809a081a0ce454b6d6003dcabc565ecb3e6afdaf" },
        "loaded_nvapi_module": {
          "type": "object",
          "additionalProperties": false,
          "required": [
            "file_name",
            "file_sha256",
            "start_address",
            "end_address",
            "proof_source"
          ],
          "properties": {
            "file_name": { "const": "nvapi_impl.dll" },
            "file_sha256": { "const": "fbc9aed43bfa5bda19b7f83a809a081a0ce454b6d6003dcabc565ecb3e6afdaf" },
            "start_address": { "$ref": "#/$defs/hex32" },
            "end_address": { "$ref": "#/$defs/hex32" },
            "proof_source": { "const": "cdb_modload_target_image" }
          }
        },
        "interface_id": { "const": "0x465f9bcf" },
        "function_rva": { "const": "0x00198010" },
        "caller_module_name": { "const": "GPU-Z.exe" },
        "caller_rva": { "const": "0x0021cee7" },
        "buffer_ebp_displacement_bytes": { "const": -80 },
        "structure_version": { "const": "0x0001004c" },
        "structure_size_bytes": { "const": 76 },
        "value_word_index": { "const": 10 },
        "value_offset_bytes": { "const": 40 },
        "scale_divisor": { "const": 1000000 }
      }
    },
    "references": {
      "type": "object",
      "additionalProperties": false,
      "required": ["gpuz", "hwinfo"],
      "properties": {
        "gpuz": {
          "allOf": [
            { "$ref": "#/$defs/growing_log_reference" },
            {
              "properties": {
                "size_bytes_before": { "maximum": 16777216 },
                "size_bytes_midpoint": { "maximum": 16777216 },
                "size_bytes_after": { "maximum": 16777216 }
              }
            }
          ]
        },
        "hwinfo": {
          "oneOf": [
            { "type": "null" },
            { "$ref": "#/$defs/growing_log_reference" }
          ]
        }
      }
    },
    "call_count": { "type": "integer", "minimum": 3, "maximum": 100000 },
    "samples": {
      "type": "array",
      "minItems": 3,
      "maxItems": 100000,
      "items": {
        "type": "object",
        "additionalProperties": false,
        "required": [
          "sequence",
          "thread_id",
          "caller_rva",
          "return_status",
          "raw_words",
          "selected_raw_microvolts",
          "selected_volts"
        ],
        "properties": {
          "sequence": { "type": "integer", "minimum": 1 },
          "thread_id": { "$ref": "#/$defs/hex32" },
          "caller_rva": { "const": "0x0021cee7" },
          "return_status": { "const": "0x00000000" },
          "raw_words": {
            "type": "array",
            "prefixItems": [{ "const": "0x0001004c" }],
            "items": { "$ref": "#/$defs/hex32" },
            "minItems": 19,
            "maxItems": 19
          },
          "selected_raw_microvolts": {
            "type": "integer",
            "minimum": 100000,
            "maximum": 2000000
          },
          "selected_volts": {
            "type": "number",
            "minimum": 0.1,
            "maximum": 2.0
          }
        }
      }
    },
    "warning": { "type": "string", "minLength": 1, "maxLength": 2000 }
  },
  "$defs": {
    "sha256": { "type": "string", "pattern": "^[0-9a-f]{64}$" },
    "hex32": { "type": "string", "pattern": "^0x[0-9a-f]{8}$" },
    "local_timestamp": {
      "type": "string",
      "pattern": "^[0-9]{4}-[0-9]{2}-[0-9]{2} [0-9]{2}:[0-9]{2}:[0-9]{2}(\\.[0-9]{3})?$"
    },
    "growing_log_reference": {
      "type": "object",
      "additionalProperties": false,
      "required": [
        "file_name",
        "prefix_sha256",
        "size_bytes_before",
        "size_bytes_midpoint",
        "size_bytes_after",
        "last_write_utc_before",
        "last_write_utc_midpoint",
        "last_write_utc_after",
        "last_sample_local_before",
        "last_sample_local_midpoint",
        "last_sample_local_after",
        "grew_during_capture"
      ],
      "properties": {
        "file_name": { "type": "string", "minLength": 1, "maxLength": 260 },
        "prefix_sha256": { "$ref": "#/$defs/sha256" },
        "size_bytes_before": { "type": "integer", "minimum": 1, "maximum": 67108864 },
        "size_bytes_midpoint": { "type": "integer", "minimum": 1, "maximum": 67108864 },
        "size_bytes_after": { "type": "integer", "minimum": 1, "maximum": 67108864 },
        "last_write_utc_before": { "type": "string", "format": "date-time" },
        "last_write_utc_midpoint": { "type": "string", "format": "date-time" },
        "last_write_utc_after": { "type": "string", "format": "date-time" },
        "last_sample_local_before": { "$ref": "#/$defs/local_timestamp" },
        "last_sample_local_midpoint": { "$ref": "#/$defs/local_timestamp" },
        "last_sample_local_after": { "$ref": "#/$defs/local_timestamp" },
        "grew_during_capture": { "const": true }
      }
    }
  }
}
