{
  "schema_version": 2,
  "source_kind": "nvapi_voltage_status_v1_observation",
  "capture_session_id": "00000000-0000-4000-8000-000000000002",
  "capture_started_utc": "2026-08-26T21:18:30.0000000Z",
  "captured_utc": "2026-08-26T21:18:42.0000000Z",
  "duration_seconds": 12,
  "process_id": 1234,
  "profile": {
    "profile_name": "gpuz-2.70.0-nvapi-610.88-voltage-status-v1",
    "gpu": {
      "name": "NVIDIA GeForce RTX 3060",
      "uuid": "GPU-11111111-2222-3333-4444-555555555555",
      "driver_version": "610.88",
      "nvml_version": "13.610.88",
      "pci_bus_id": "00000000:01:00.0",
      "pci_vendor_id": "0x10de",
      "pci_device_id": "0x2504",
      "pci_subsystem_vendor_id": "0x10de",
      "pci_subsystem_device_id": "0x1536",
      "vbios_version": "94.06.25.00.fc"
    },
    "identity_probe_sha256": "1111111111111111111111111111111111111111111111111111111111111111",
    "gpuz_sha256": "6cb0ef29682452de81a9576808881685161411a1fad00938ba04131159979c29",
    "debugger_sha256": "2222222222222222222222222222222222222222222222222222222222222222",
    "debugger_file_version": "10.0.26100.1",
    "candidate_inventory_sha256": "3aaada9b367dacca7cf74511bae8532bd79b7f8bd06b9bb609056f3d9da1f1d7",
    "prior_observation_sha256": "c7a63df5e6a30bccbba5ad8c1a62a9251c40d512cd74060e69e043cfc54f77b3",
    "nvapi_module_sha256": "fbc9aed43bfa5bda19b7f83a809a081a0ce454b6d6003dcabc565ecb3e6afdaf",
    "loaded_nvapi_module": {
      "file_name": "nvapi_impl.dll",
      "file_sha256": "fbc9aed43bfa5bda19b7f83a809a081a0ce454b6d6003dcabc565ecb3e6afdaf",
      "start_address": "0x68000000",
      "end_address": "0x685f5000",
      "proof_source": "cdb_modload_target_image"
    },
    "interface_id": "0x465f9bcf",
    "function_rva": "0x00198010",
    "caller_module_name": "GPU-Z.exe",
    "caller_rva": "0x0021cee7",
    "buffer_ebp_displacement_bytes": -80,
    "structure_version": "0x0001004c",
    "structure_size_bytes": 76,
    "value_word_index": 10,
    "value_offset_bytes": 40,
    "scale_divisor": 1000000
  },
  "references": {
    "gpuz": {
      "file_name": "gpuz-voltage-reference.csv",
      "prefix_sha256": "40006711f36bd1bc8cf743862730f8237be6dc633759fa743f80d8f16fa976ac",
      "size_bytes_before": 47,
      "size_bytes_midpoint": 95,
      "size_bytes_after": 143,
      "last_write_utc_before": "2026-08-26T21:18:31.0000000Z",
      "last_write_utc_midpoint": "2026-08-26T21:18:32.0000000Z",
      "last_write_utc_after": "2026-08-26T21:18:33.0000000Z",
      "last_sample_local_before": "2026-08-26 18:18:31",
      "last_sample_local_midpoint": "2026-08-26 18:18:32",
      "last_sample_local_after": "2026-08-26 18:18:33",
      "grew_during_capture": true
    },
    "hwinfo": {
      "file_name": "hwinfo-voltage-reference.csv",
      "prefix_sha256": "26f148f144983dd42699e1c825203d839b204e515a0422ecc816d74ed367245b",
      "size_bytes_before": 50,
      "size_bytes_midpoint": 100,
      "size_bytes_after": 152,
      "last_write_utc_before": "2026-08-26T21:18:31.0000000Z",
      "last_write_utc_midpoint": "2026-08-26T21:18:32.0000000Z",
      "last_write_utc_after": "2026-08-26T21:18:33.0000000Z",
      "last_sample_local_before": "2026-08-26 18:18:31.000",
      "last_sample_local_midpoint": "2026-08-26 18:18:32.000",
      "last_sample_local_after": "2026-08-26 18:18:33.000",
      "grew_during_capture": true
    }
  },
  "call_count": 3,
  "samples": [
    {
      "sequence": 1,
      "thread_id": "0x000075bc",
      "caller_rva": "0x0021cee7",
      "return_status": "0x00000000",
      "raw_words": ["0x0001004c", "0x00000000", "0x00000000", "0x00000000", "0x00000000", "0x00000000", "0x00000000", "0x00000000", "0x00000000", "0x00000000", "0x00107fa2", "0x00000000", "0x00000000", "0x00000000", "0x00000000", "0x00000000", "0x00000000", "0x00000000", "0x00000000"],
      "selected_raw_microvolts": 1081250,
      "selected_volts": 1.08125
    },
    {
      "sequence": 2,
      "thread_id": "0x000075bc",
      "caller_rva": "0x0021cee7",
      "return_status": "0x00000000",
      "raw_words": ["0x0001004c", "0x00000000", "0x00000000", "0x00000000", "0x00000000", "0x00000000", "0x00000000", "0x00000000", "0x00000000", "0x00000000", "0x000d418e", "0x00000000", "0x00000000", "0x00000000", "0x00000000", "0x00000000", "0x00000000", "0x00000000", "0x00000000"],
      "selected_raw_microvolts": 868750,
      "selected_volts": 0.86875
    },
    {
      "sequence": 3,
      "thread_id": "0x000075bc",
      "caller_rva": "0x0021cee7",
      "return_status": "0x00000000",
      "raw_words": ["0x0001004c", "0x00000000", "0x00000000", "0x00000000", "0x00000000", "0x00000000", "0x00000000", "0x00000000", "0x00000000", "0x00000000", "0x000e4e1c", "0x00000000", "0x00000000", "0x00000000", "0x00000000", "0x00000000", "0x00000000", "0x00000000", "0x00000000"],
      "selected_raw_microvolts": 937500,
      "selected_volts": 0.9375
    }
  ],
  "warning": "Synthetic fixed-profile multi-point observation used only by hardware-independent tests."
}
